url,title,description,domain,page
https://easyapply.co/a/fdfebc4f-70ad-448a-be90-3ebf75746eb0,In-House Counsel at Matix Lumber Inc. - easyapply.co,Matix Lumber Inc. is a family and locally owned and operated professional building supply centre that provides for all your building needs. We are a building supply and project centre providing …,easyapply.co,1
https://sjso.easyapply.co/,View jobs at ST JOHN PARISH SHERIFF'S OFFICE,"About ST JOHN PARISH SHERIFF'S OFFICE. Thank you for your interest in employment with the St. John Parish Sheriff's Office! Led by Sheriff Mike Tregre, the St. John Parish Sheriff's …",sjso.easyapply.co,1
https://iberiamedicalcenter.easyapply.co/,View jobs at IBERIA MEDICAL CENTER,IBERIA MEDICAL CENTER . The mission of Iberia Medical Center is to improve the health and quality of life in our community. Our vision is to be the premier healthcare delivery system of …,iberiamedicalcenter.easyapply.co,1
https://greenhillassociatesinc.easyapply.co/,View jobs at Green Hill Associates Inc.,"La Grande, OR. Green Hill Associates Inc is seeking an Apartment Manager for a multi-family affordable housing project. The ideal candidate is a self-driven, adaptable individual…",greenhillassociatesinc.easyapply.co,1
https://canlinenergycorp.easyapply.co/,View jobs at Canlin Energy,"About Canlin Energy. Canlin Energy Corporation is a privately held, long reserve life, natural gas weighted intermediate producer, proudly operating in the Western Canadian Sedimentary …",canlinenergycorp.easyapply.co,1
https://teamready.easyapply.co/,View jobs at READY®,"Job Summary This role is responsible for conducting market research, analyzing business insights, tracking competitive brands and products, studying retailer activity...",teamready.easyapply.co,1
https://hydrofarm.easyapply.co/,View jobs at Hydrofarm LLC,"About Hydrofarm LLC. Hydrofarm is a leading manufacturer, distributor and marketer of hydroponics equipment and supplies for controlled environment agriculture, including LED …",hydrofarm.easyapply.co,1
https://jaxinc.easyapply.co/,View jobs at JAX Mercantile Co.,"JAX Mercantile Co. is a family and employee owned business with a heart for customer service, conservation, and community. Established in 1955, JAX stores...",jaxinc.easyapply.co,1
https://altradsparrowsuscareers.easyapply.co/,View jobs at Altrad Sparrows,"Sulphur, LA. Join Our Dynamic Team at Altrad Sparrows! Are you ready to take your career to new heights? Altrad Sparrows, a part of Altrad Group, is a global provider of…",altradsparrowsuscareers.easyapply.co,1
https://pthm.easyapply.co/,View jobs at Peachtree Hospitality Management,"Peachtree Hospitality Management . Peachtree Hotel Group operates, develops, finances, and invests in premium-branded, select- and limited-service, extended-stay, and compact full …",pthm.easyapply.co,1
