url,title,description,domain,page
https://easyapply.co/product/hiring,Hiring & Onboarding| GetHired.com - easyapply.co,"You can automatically schedule interviews, collaborate with other hiring managers, take notes on candidate profiles, and much more. If your business has advanced needs, you can enable …",easyapply.co,1
http://dalecountyal.com/CurrentJobListings.aspx,Current Job Listings - Dale County Al,All positions require a valid AL driver's license or the ability to obtain one prior to employment. Apply by E-mail: Download EMPLOYMENT APPLICATION fill out and save to your computer.,dalecountyal.com,1
https://tweedjobs.easyapply.co/,View jobs at TUMBLEWEED INC,"May 14, 2025· Tumbleweed Restaurants is currently hiring for a driven Carry Out Crew Member to take charge of the customer service duties in our restaurants. Whether through... View Job. Busser - New Albany, IN (CCX) New Albany, IN …",tweedjobs.easyapply.co,2
https://careerlink.com/,"JobSearch, Career Advice & Employer Tools","Search job postings, get career advice and be found by hiring employers in your area. Create a profile today. ... Brand Hydraulics Co. Omaha, NE . Part-time . 27 May ( 5 days ago ) Careerlink helped over 1 million people get the career they …",careerlink.com,2
https://heritagepark.easyapply.co/,View jobs at Heritage Park,"Job Title: A/V Tech Assistant Hourly Rate: $17.50 Contract Term: 8-week term, starting May 2025 Hours of Work: 35 hours per week Position Type: Canada Summer Jobs... View Job. Special …",heritagepark.easyapply.co,2
https://weismanchildrens.easyapply.co/,View jobs at Weisman Childrens Rehabilitation Hospital,About Weisman Childrens Rehabilitation Hospital. Weisman Children’s is a highly-acclaimed community-based specialty healthcare organization consisting of an acute rehabilitation …,weismanchildrens.easyapply.co,2
https://romancatholicchurchdioceseofho.easyapply.co/,View jobs at ROMAN CATHOLIC CHURCH DIOCESE OF …,"Job Description The Parish/Cemetery Facilities Associate is a part-time, non-exempt position that will be responsible for the maintenance and upkeep of the parish... View Job. Vandebilt …",romancatholicchurchdioceseofho.easyapply.co,2
https://vacfsscareers.easyapply.co/,Vancouver Aboriginal Child & Family Services Society,"View Job Family Preservation Clinical Supervisor Vancouver, British Columbia Full-time $90797.03-$103.69/year",vacfsscareers.easyapply.co,2
