url,title,description,domain,page,source_file
https://abilitymattersohio.easyapply.co/,View jobs at Ability Matters,"Dublin, OH. Summary:The Overnight Assistant Director of Housing provides after-hours leadership, supervision, andoperational support for residential programs serving individuals…",abilitymattersohio.easyapply.co,5,improved_bing_strategy_02_20250604_122744.csv
https://altradsparrowsuscareers.easyapply.co/,View jobs at Altrad Sparrows,"Sulphur, LA. Join Our Dynamic Team at Altrad Sparrows! Are you ready to take your career to new heights? Altrad Sparrows, a part of Altrad Group, is a global provider of…",altradsparrowsuscareers.easyapply.co,1,improved_bing_strategy_01_20250604_122744.csv
https://alwaysawayllc.easyapply.co/,View jobs at Always A Way LLC,"Boise, ID. Always A Way is seeking a Mental health therapist to join our clinic's team! Our growing clinic serves a diverse population of both adults and children with mental…",alwaysawayllc.easyapply.co,4,improved_bing_strategy_08_20250604_122744.csv
https://aurora.easyapply.co/,View jobs at Aurora,"We not only provide individual, personalized care; we also try to make you feel at home. Our goal is to make you feel as comfortable as possible during your …",aurora.easyapply.co,1,improved_bing_strategy_02_20250604_122744.csv
https://bgckawarthas.easyapply.co/,View jobs at BGC Kawarthas,"About BGC Kawarthas. BGC Kawarthas is a registered non-profit charitable organization devoted to serving and strengthening children, youth and families throughout the City of Kawartha …",bgckawarthas.easyapply.co,3,improved_bing_strategy_02_20250604_122744.csv
https://bigtopeventsllc.easyapply.co/,View jobs at BIG TOP EVENTS LLC,"Madison, WI. Hospitality Assistants have a direct impact on the customer experience at Breese Stevens Field. They will work in our luxury suite areas and exclusive ticketed areas.…",bigtopeventsllc.easyapply.co,3,improved_bing_strategy_08_20250604_122744.csv
https://brightisle.easyapply.co/,Viewjobsat Brightisle,"If you're looking for a place where your career can thrive, where diversity is celebrated, and where your values align with your work, Brightisle is the place for you. Join our team and grow with us. Together, we'll shape a brighter future. View company website.",brightisle.easyapply.co,3,improved_bing_strategy_05_20250604_122744.csv
https://builtwith.com/easyapply.co,easyapply.coTechnology Profile - BuiltWith,Web technologies easyapply.co is using on their website. Google Analytics. Google Analytics Usage Statistics · Download List of All Websites using Google Analytics. Google Analytics …,builtwith.com,4,improved_bing_strategy_03_20250604_122744.csv
https://canlinenergycorp.easyapply.co/,View jobs at Canlin Energy,"About Canlin Energy. Canlin Energy Corporation is a privately held, long reserve life, natural gas weighted intermediate producer, proudly operating in the Western Canadian Sedimentary …",canlinenergycorp.easyapply.co,1,improved_bing_strategy_01_20250604_122744.csv
https://career.easyapply.co/,"easyapply.co - View jobs at GetHired, Inc.",There are currently no open jobs. GetHired.com is a revolutionary new tool designed to help employers and jobseekers connect using technology.,career.easyapply.co,1,improved_bing_strategy_05_20250604_122744.csv
https://cmhamidisland.easyapply.co/,Viewjobsat Canadian Mental Health Association Mid-Island,"About Canadian Mental Health Association Mid-Island. Canadian Mental Health Association, Mid-Island Branch (CMHA MI) is a not-for-profit, charitable organization providing housing, homelessness, biopsychosocial-spiritual and harm reduction services on Vancouver Island from the Nanaimo Regional District to the Comox Valley.",cmhamidisland.easyapply.co,3,improved_bing_strategy_05_20250604_122744.csv
https://communitybiblechurch.easyapply.co/,Viewjobsat Community Bible Church,"About Community Bible Church. Community Bible Church looks for high honor, humility, hustle, hospitality, and high capacity staff with a wide variety of gifts and talents.",communitybiblechurch.easyapply.co,3,improved_bing_strategy_05_20250604_122744.csv
https://communitydevelopmentcouncildurha.easyapply.co/,View jobs at Community Development Council Durham,"Community Development Council Durham . Community Development Council Durham (CDCD) is an independent, not-for-profit social planning organization that has been working to enhance …",communitydevelopmentcouncildurha.easyapply.co,3,improved_bing_strategy_02_20250604_122744.csv
https://cside.dev/domains/easyapply.co,What is easyapply.co? - c/side,"Jan 10, 2025· Easyapply.co appears to be a job application platform or recruitment service, but its exact purpose is unclear. It's a relatively new domain, registered in 2017, and has a neutral …",cside.dev,1,improved_bing_strategy_03_20250604_122744.csv
https://datamarsinc.easyapply.co/,easyapply.co- Viewjobsat DATAMARS,"Jobs at DATAMARS. Share on. DATAMARS. View company website. View open positions . DATAMARS View company website . View open positions . About DATAMARS. Datamars Inc. is a leading global supplier of integrated product solutions in livestock management, animal health delivery, pet identification, and reunification and textile identification. ...",datamarsinc.easyapply.co,4,improved_bing_strategy_05_20250604_122744.csv
https://easyapply.co/a/fdfebc4f-70ad-448a-be90-3ebf75746eb0,In-House Counsel at Matix Lumber Inc. - easyapply.co,Matix Lumber Inc. is a family and locally owned and operated professional building supply centre that provides for all your building needs. We are a building supply and project centre providing …,easyapply.co,1,improved_bing_strategy_01_20250604_122744.csv
https://easyapply.co/,easyapply.co,"Post a job to top job boards and social media sites in one click, ask optional pre-screening questions using video and audio, automatically send interview requests and quickly find the …",easyapply.co,1,improved_bing_strategy_02_20250604_122744.csv
https://easyapply.co/login,Login | GetHired - easyapply.co,"Post a job to multiple job boards in one click with GetHired. Search resume database, hire fast, save time and money.",easyapply.co,1,improved_bing_strategy_02_20250604_122744.csv
https://easyapply.co/product/hiring,Hiring & Onboarding| GetHired.com - easyapply.co,GetHired’s applicant tracking system allows you to quickly create a job posting that can be distributed to the top job boards and social media sites in just a …,easyapply.co,1,improved_bing_strategy_02_20250604_122744.csv
https://easyapply.co/apply/invalidjob,GetHired -easyapply.co,"GetHired helps you get more interviews and more offers so you can find the career of your dreams. Employers, find top quality candidates at no cost. Learn more today.",easyapply.co,3,improved_bing_strategy_02_20250604_122744.csv
https://easyapply.co/site/terms-of-service,GetHired -easyapply.co,"in a co unt ry as a cond ition of employment, unl ess otherwise required in order to comp ly with. law, regulatio ns, ex e cu t iv e order, or federal, state or local gov er n ment contract; (b.iii) p …",easyapply.co,4,improved_bing_strategy_02_20250604_122744.csv
https://easyapply.co/a/4796de75-f7c0-4b8d-922d-7cdf50369c4b,General Application at Tahltan Nation Development LP -easyapply.co,Are you looking for a work environment that's invested in your success?. A team that values one another? Prioritize safety and culture? Expanding your career and qualifications? Potential …,easyapply.co,3,improved_bing_strategy_03_20250604_122744.csv
https://easyapply.co/a/f7e85860-6243-4243-9b20-02b11e20de4e,General Application for Regent Park Rehabilitation & Healthcare,Apply online at https://rprh.easyapply.co/. You will be required to fill out an online application to move forward in the selection process (we do not accept just a resume). If you would like …,easyapply.co,3,improved_bing_strategy_03_20250604_122744.csv
https://easyapply.co/a/05fb6799-6790-4613-8ab9-1d6ca5e6bc01,Seasonal Grounds Technician at TANGANYIKA WILDLIFE PARK LLC -easyapply.co,"Mar 1, 2024· Apply at https://tagannyikawildlifeparkllc.easyapply.co If you have any issues apply please email amoody@twpark.com for assistance. View all jobs at this company",easyapply.co,3,improved_bing_strategy_03_20250604_122744.csv
https://easyapply.co/a/480e0d0f-b7ea-4fd6-babe-7fe59b05c049,Water Resources Engineer at Biohabitats -easyapply.co,Biohabitats is seeking a Water Resources Engineer with an understanding of regional ecology and experience in nature-based design and/or ecological restoration to join our Chesapeake / …,easyapply.co,5,improved_bing_strategy_03_20250604_122744.csv
https://easyapply.co/a/6c90b537-d1e4-4ec2-8761-df01eaa35efc,Paraprofessional at Ability Matters -easyapply.co,Hiring Bonus: Earn up to $500 as part of our commitment to your success. Make a Real Difference: Join Ability Matters! Help transform the lives of students with disabilities by creating …,easyapply.co,5,improved_bing_strategy_03_20250604_122744.csv
https://easyapply.co/a/730eabc0-0cd4-4d56-ba55-fbfc31df5723,GetHired -easyapply.co,"GetHired helps you get more interviews and more offers so you can find the career of your dreams. Employers, find top quality candidates at no cost. Learn more today.",easyapply.co,5,improved_bing_strategy_03_20250604_122744.csv
https://easyapply.co/job/general-application-41,GeneralApplicationat Community Bible Church -easyapply.co,Candidates completing a General Application should first determine if there is a specific position to apply for and complete the corresponding application. If no positions are posted in your area of interest please indicate your area of interest in your general application.,easyapply.co,3,improved_bing_strategy_08_20250604_122744.csv
https://easyapply.co/job/general-job-posting,GeneralApplicationat Tahltan Nation Development LP -easyapply.co,Are you looking for a work environment that's invested in your success?. A team that values one another? Prioritize safety and culture? Expanding your career and qualifications? Potential working long term or seasonal?,easyapply.co,3,improved_bing_strategy_08_20250604_122744.csv
https://easyapply.co/a/application-form/7c8720a0-9577-432d-865d-6316b005d645,"Towing Deckhand at Wood Resources, LLC - GetHired.com","Towing Deckhand Job Description . For more than 70 years, Wood Resources has continued to provide marine towing, ship mooring, dredging, as well as construction and landscaping materials. Position Summary: Deckhands assist in the operation and maintenance of Wood Resources marine vessels.",easyapply.co,3,improved_bing_strategy_08_20250604_122744.csv
https://easyapply.co/job/medium-duty-truck-driver-to-pick-up-donations-2,Medium Duty Box Truck Driver at Waterfront Rescue Mission -easyapply.co,Drives ministry trucks to donor locations and picks-up donated items. Performs all preventive maintenance checks and informs supervisor of items needing repair and items that create safety deficiencies.,easyapply.co,3,improved_bing_strategy_08_20250604_122744.csv
https://easyapply.co/a/3314aef2-cb37-401b-b6ca-3b87b70f3963,Generic Job Applicationat St. James House of Baytown,"If there are no specific positions open at St. James House that you are interested in applying for, please submit your application here. We will gladly keep your application on file. St. James House of Baytown is an EEO employer - M/F/Vets/Disabled . View all jobs at this company. Upload ...",easyapply.co,4,improved_bing_strategy_08_20250604_122744.csv
https://easyapply.co.siteindices.com/,"Easyapply / Beautiful, Effective, Easy-To-Use HR Software for …","Easyapply.co has an estimated worth of US$ 405,155, based on its estimated Ads revenue. Easyapply.co receives approximately 35,238 unique visitors each day. Its web server is …",easyapply.co.siteindices.com,3,improved_bing_strategy_03_20250604_122744.csv
https://elmllc.easyapply.co/,easyapply.co- View jobs at ELM Utility Services,"Denver, CO ELM Utility Services, with over 1300 employees nationwide, has an outstanding opportunity as a Gas Leak Survey Technicians to work in the Ft. Collins, Longmont,… Apply",elmllc.easyapply.co,5,improved_bing_strategy_02_20250604_122744.csv
https://figrjobs.easyapply.co/,easyapply.co- View jobs at Canada's Island Garden,"Canada's Island Garden Inc., known through our brands FIGR, Piper's Punch, and Riptides, is 100% PEI-owned and operated and we proudly embrace the coastal...",figrjobs.easyapply.co,5,improved_bing_strategy_02_20250604_122744.csv
https://firstuniteddtes.easyapply.co/,easyapply.co- View jobs at First United,About FIRST UNITED FIRST UNITED CHURCH Community Ministry Society (commonly known as FIRST UNITED) envisions a neighbourhood where the worth of every...,firstuniteddtes.easyapply.co,4,improved_bing_strategy_02_20250604_122744.csv
https://forcepsi.easyapply.co/,easyapply.co- View jobs at FORCE PRESSURE CONTROL LLC,"At its core, Force Pressure Control is a service-focused company that offers surface pressure control solutions in the oilfield services market.",forcepsi.easyapply.co,4,improved_bing_strategy_02_20250604_122744.csv
https://fowlerjobs.easyapply.co/,easyapply.co- Viewjobsat Juliette Fowler Communities,"Current Job Openings: Filter. Search. Apply. PRN C.N.A., C.M.A. & LVN. Dallas, TX. Juliette Fowler Communities is a certified Great Place to Work. We are …",fowlerjobs.easyapply.co,2,improved_bing_strategy_04_20250604_122744.csv
https://freightbreakersllc.easyapply.co/,View jobs at Freight Breakers LLC,"Blakeslee, Pennsylvania. 3rd Shift Tire Loader/Unloader Earn up to $500-$1,000 a week. Work type: Loading and Unloading tires out of trailers. Pay: Production pay average $500-$1000 a …",freightbreakersllc.easyapply.co,4,improved_bing_strategy_02_20250604_122744.csv
https://freightbreakersllc.easyapply.co/job/box-unloader-irving,Box Unloader (Irving) at Freight Breakers LLC,"For quick interview setups text: 817-856-9535, Make sure to include your name/ preferred shift and preferred date/time for interview. We are looking for loading / unloading associates who …",freightbreakersllc.easyapply.co,3,improved_bing_strategy_03_20250604_122744.csv
https://gethiredatpeninsulacoop.easyapply.co/,View jobs at PeninsulaCo-op,"Peninsula Co-op channels over $500,000 of our profits each year, to local charities. We are locally owned; taking pride in our roots and uphold a tradition of sharing profits with our 116,000 …",gethiredatpeninsulacoop.easyapply.co,5,improved_bing_strategy_02_20250604_122744.csv
https://goodwillindustriesofsoutheasternlousisana.easyapply.co/,easyapply.co- View jobs at GOODWILL INDUSTRIES OF …,"GOODWILL INDUSTRIES OF SOUTHEASTERN LOUISIANA . Goodwill Industries of Southeastern Louisiana, Inc. offers opportunities to people with disabilities and other barriers …",goodwillindustriesofsoutheasternlousisana.easyapply.co,5,improved_bing_strategy_02_20250604_122744.csv
https://greenhillassociatesinc.easyapply.co/,View jobs at Green Hill Associates Inc.,"La Grande, OR. Green Hill Associates Inc is seeking an Apartment Manager for a multi-family affordable housing project. The ideal candidate is a self-driven, adaptable individual…",greenhillassociatesinc.easyapply.co,1,improved_bing_strategy_01_20250604_122744.csv
https://greens.easyapply.co/,Viewjobsat Greens,"Greens . Greens Group is a privately held real estate development and hotel company built on a strong heritage of deep values. Greens Group has steadily grown its market presence by investing prudently, managing effectively, and operating efficiently.",greens.easyapply.co,2,improved_bing_strategy_05_20250604_122744.csv
https://gslholdings.easyapply.co/,Viewjobsat GSL Group,"About GSL Group. GSL Group includes a wide range of businesses including Real Estate Development and Construction (Commercial, Industrial, Residential, Sports and Entertainment Facilities), E-commerce, Sports, Live Entertainment, Food & Beverage, and Hospitality.",gslholdings.easyapply.co,5,improved_bing_strategy_05_20250604_122744.csv
https://gtpavilions.easyapply.co/,View jobs at Grand Traverse Pavilions,About Grand Traverse Pavilions. Grand Traverse Pavilions is the region's trusted partner and recognized leader for successful aging services. The Pavilions is owned by Grand Traverse …,gtpavilions.easyapply.co,3,improved_bing_strategy_02_20250604_122744.csv
https://hbssystemsinc.easyapply.co/job/hbs-systems-application-6,HBS SystemsApplicationat HBS SYSTEMS INC - hbssystemsinc.easyapply.co,"If you would like to contact us regarding the accessibility of our website or need assistance completing the application process, please contact Alaina Jeanblanc/HR Manager at 972-234-4444 or careers@hbssystems.com",hbssystemsinc.easyapply.co,3,improved_bing_strategy_08_20250604_122744.csv
https://heritagepark.easyapply.co/,View jobs at Heritage Park,"About Heritage Park. Heritage Park is one of Canada’s largest living history museums, with hundreds of exhibits, rides, shops, restaurants and daily demonstrations and activities to keep …",heritagepark.easyapply.co,4,improved_bing_strategy_02_20250604_122744.csv
https://hydrofarm.easyapply.co/,View jobs at Hydrofarm LLC,"About Hydrofarm LLC. Hydrofarm is a leading manufacturer, distributor and marketer of hydroponics equipment and supplies for controlled environment agriculture, including LED …",hydrofarm.easyapply.co,1,improved_bing_strategy_01_20250604_122744.csv
https://hypestat.com/info/easyapply.co,"Easyapply.coBeautiful, Effective, Easy-To-Use HR Software","• Easyapply.co receives approximately 7K visitors and 14,788 page impressions per day. Which countries does Easyapply.co receive most of its visitors from? • Easyapply.co is mostly visited …",hypestat.com,2,improved_bing_strategy_03_20250604_122744.csv
https://iberiamedicalcenter.easyapply.co/,View jobs at IBERIA MEDICAL CENTER,IBERIA MEDICAL CENTER . The mission of Iberia Medical Center is to improve the health and quality of life in our community. Our vision is to be the premier healthcare delivery system of …,iberiamedicalcenter.easyapply.co,1,improved_bing_strategy_01_20250604_122744.csv
https://innforks.easyapply.co/,Viewjobsat Inn at the Forks,"About Inn at the Forks. Inn at the Forks is a 116-room Luxury Boutique Hotel, located at The Forks, Winnipeg's top tourist destination. It is home to Riverstone Spa and SMITH Restaurant, along with 8000+ square feet of meeting space.",innforks.easyapply.co,3,improved_bing_strategy_05_20250604_122744.csv
https://italiancentreshop.easyapply.co/,View jobs at Italian Centre Shop,About Italian Centre Shop. Italian Centre Shop connects community through food and cultural experiences. We are a gathering place where we offer the best-known European products; we …,italiancentreshop.easyapply.co,3,improved_bing_strategy_02_20250604_122744.csv
https://jainc.easyapply.co/,View jobs at J & A INC,"J & A INC . J & A, Inc. 's mission is to create stable, vibrant, and healthy communities by developing, financing, and operating affordable housing for families, seniors, and people with special needs who lack the economic resources to access quality, safe housing opportunities.",jainc.easyapply.co,5,improved_bing_strategy_08_20250604_122744.csv
https://jasonaldeansgat.easyapply.co/,"Viewjobsat Jason Aldean's, Gatlinburg","Gatlinburg, TN. POSITION SUMMARY: This role's primary function is to oversee all kitchen operations including ordering and inventory, and responsible for all food coming out of…",jasonaldeansgat.easyapply.co,5,improved_bing_strategy_05_20250604_122744.csv
https://jaxinc.easyapply.co/,View jobs at JAX Mercantile Co.,"JAX Mercantile Co. is a family and employee owned business with a heart for customer service, conservation, and community. Established in 1955, JAX stores...",jaxinc.easyapply.co,1,improved_bing_strategy_01_20250604_122744.csv
https://landseacampservices.easyapply.co/,easyapply.co- Viewjobsat LandSea Camp Services,"Are you interested in working with LandSea Camps? Here, you can submit your resume to our general applications for the following positions: Chef 1st Cook2nd Cook3rd...",landseacampservices.easyapply.co,5,improved_bing_strategy_05_20250604_122744.csv
https://laundryopsllc.easyapply.co/,Viewjobsat LAUNDRY OPS LLC,"Chicago, IL. WashSmart Laundry is growing, come and join our amazing team of talented people and grow your career with us! See why we are Chicagoland’s best laundry ...",laundryopsllc.easyapply.co,5,improved_bing_strategy_05_20250604_122744.csv
https://lifesjourneyinc.easyapply.co/,Viewjobsat Life's Journey Inc,"About Life's Journey Inc. Life’s Journey Inc. is a non-profit social services agency operating in Winnipeg, Brandon, and Steinbach Manitoba. We acknowledge that we gather and work on Treaty 1 and 2 land, traditional territories of the Anishinaabeg, Cree, Oji-Cree, Assiniboine, Dakota and Dene Peoples, and the homeland of the Métis Nation.",lifesjourneyinc.easyapply.co,5,improved_bing_strategy_05_20250604_122744.csv
https://lincolnparkmanor.easyapply.co/,View jobs at Lincoln Park Manor,"Lincoln, KS. Lincoln Park Manor is looking for PRN CNA's to work all shifts., weekends needed. For more information you can call 785-524-4428, or email …",lincolnparkmanor.easyapply.co,5,improved_bing_strategy_03_20250604_122744.csv
https://manningparkresort.easyapply.co/,Viewjobsat Manning Park Resort,"About Manning Park Resort. Do you love exploring and playing in the outdoors, making new friends, hanging around the campfire, canoeing, kayaking, stand up paddle boarding, snowboarding, skiing, and snowshoeing?",manningparkresort.easyapply.co,3,improved_bing_strategy_05_20250604_122744.csv
https://mhco.easyapply.co/,easyapply.co - View jobs at Mennonite Home Communities of Ohio,"For more than 60 years, Mennonite Home Communities of Ohio has been the senior housing and health care provider of choice in the Bluffton area. MHCO provides independent living, …",mhco.easyapply.co,1,improved_bing_strategy_05_20250604_122744.csv
https://mhgcareers.easyapply.co/,easyapply.co - View jobs at Murphy Hospitality Group,"Murphy Hospitality Group includes 20 food and beverage operations, 3 boutique hotels and the Prince Edward Island Brewing Company.",mhgcareers.easyapply.co,1,improved_bing_strategy_05_20250604_122744.csv
https://nationalww2museuminc.easyapply.co/,View jobs at The National WWII Museum,"Consistent with the Americans with Disabilities Act, applicants may request accommodations needed to participate in the application process. The National WWII Museum offers a competitive wage and benefits package which includes the following: • Competitive wages • Medical insurance 2 plan options; Museum pays 75% of premium",nationalww2museuminc.easyapply.co,4,improved_bing_strategy_08_20250604_122744.csv
https://nechc.easyapply.co/,Viewjobsat North End Community Health Centre,"Multiple positions are available at the clinic, ranging from casual to full-time (1.0 FTE). Flexible start dates can be offered. Job Purpose: The Family Practice...",nechc.easyapply.co,4,improved_bing_strategy_05_20250604_122744.csv
https://pthm.easyapply.co/,View jobs at Peachtree Hospitality Management,"Peachtree Hospitality Management . Peachtree Hotel Group operates, develops, finances, and invests in premium-branded, select- and limited-service, extended-stay, and compact full …",pthm.easyapply.co,1,improved_bing_strategy_01_20250604_122744.csv
https://rebelathletic.easyapply.co/,Viewjobsat REBEL ATHLETIC INC,"Rebel Athletic, based in Dallas TX, is the fastest growing cheerleading uniform company in the world. Since 2012, Rebel has turned heads quicker than any...",rebelathletic.easyapply.co,4,improved_bing_strategy_05_20250604_122744.csv
https://romancatholicchurchdioceseofho.easyapply.co/,Viewjobsat ROMAN CATHOLIC CHURCH DIOCESE OF …,"About ROMAN CATHOLIC CHURCH DIOCESE OF HOUMA THIBODAUX. We are the Diocese of Houma-Thibodaux founded on June 5, 1977. Our Diocese is comprised of the civil Parishes of Terrebonne and Lafourche, as well as parts of St. Mary and Jefferson Parishes.",romancatholicchurchdioceseofho.easyapply.co,5,improved_bing_strategy_05_20250604_122744.csv
https://seccareers.easyapply.co/,easyapply.co - View jobs at Social Enterprise for Canada,"Social Enterprise for Canada (SEC) is a not-for-profit, registered charity that develops and manages a number of compassionate and social purpose services. These services include, Family, Youth and Children's Services, Newcomer …",seccareers.easyapply.co,1,improved_bing_strategy_05_20250604_122744.csv
https://seotoolscenters.com/seo-analyse/domain/easyapply.co,"Easyapply.coSEO Issues, Traffic and Optimization Tips",SEO score for Easyapply.co is 60. View in-depth website analysis to improve your web page speed and also fix your SEO mistakes.,seotoolscenters.com,5,improved_bing_strategy_03_20250604_122744.csv
https://shawenimabinoojiiinc.easyapply.co/,View jobs at Shawenim Abinoojii Inc.,Welcome to Shawenim Abinoojii Inc. Shawenim Abinoojii is a non-profit service provider and Southeast First Nations-led organization. We offer...,shawenimabinoojiiinc.easyapply.co,5,improved_bing_strategy_02_20250604_122744.csv
https://sjso.easyapply.co/,View jobs at ST JOHN PARISH SHERIFF'S OFFICE,"About ST JOHN PARISH SHERIFF'S OFFICE. Thank you for your interest in employment with the St. John Parish Sheriff's Office! Led by Sheriff Mike Tregre, the St. John Parish Sheriff's …",sjso.easyapply.co,1,improved_bing_strategy_01_20250604_122744.csv
https://stjameshouse.easyapply.co/,View jobs at St. James House of Baytown,St. James House of Baytown . St. James House of Baytown is passionately committed to a nurturing environment that empowers our skilled nursing community and independent living …,stjameshouse.easyapply.co,5,improved_bing_strategy_02_20250604_122744.csv
