url,title,description,domain,page,source_file
https://stjamesparish.easyapply.co/,View jobs at ST. JAMES PARISH GOVERNMENT,"Convent, Louisiana. St. James Parish Government is hiring for - Automotive Specialist - under the Department of Human Resources. JOB FUNCTION: The Transit automotive specialist will…",stjamesparish.easyapply.co,5,improved_bing_strategy_02_20250604_122744.csv
https://sur.ly/i/easyapply.co/,"easyapply.co - Beautiful, Effective, Easy-To-... - Easy Apply","easyapply.co. Hiring and Onboarding, Time and Attendance, Benefits Administration. GetHired's HR product suite is designed to help your business...",sur.ly,1,improved_bing_strategy_03_20250604_122744.csv
https://tcrg.easyapply.co/,easyapply.co- View jobs at TC Restaurant Group,"Nashville, TN. POSITION SUMMARY: The VIP Cocktail Server is responsible for upscale beverage service of all tables and seating areas in a high-volume, live entertainment, bar…",tcrg.easyapply.co,3,improved_bing_strategy_02_20250604_122744.csv
https://teamready.easyapply.co/,View jobs at READY®,"Job Summary This role is responsible for conducting market research, analyzing business insights, tracking competitive brands and products, studying retailer activity...",teamready.easyapply.co,1,improved_bing_strategy_01_20250604_122744.csv
https://theharborsideinn.easyapply.co/,easyapply.co- View jobs at HARBORSIDE INN CONDO TRUST,"About HARBORSIDE INN CONDO TRUST. Located on the harbor in the heart of Edgartown, the Harborside Inn is Marthaâ€™s Vineyardâ€™s premier waterfront resort.",theharborsideinn.easyapply.co,3,improved_bing_strategy_02_20250604_122744.csv
https://thelinkmb.easyapply.co/,easyapply.co- View jobs at The Link: Youth and …,About The Link: Youth and Family Supports. The Link is honoured to be situated on Indigenous lands where we work with Indigenous and non-Indigenous …,thelinkmb.easyapply.co,2,improved_bing_strategy_02_20250604_122744.csv
https://tndc.easyapply.co/,easyapply.co - View jobs at Tahltan Nation Development LP,"With roots in residential construction, TNDC’s services have expanded to heavy construction, earthworks, camp services, air support, aviation, forestry, transportation, and fibre-optic …",tndc.easyapply.co,1,improved_bing_strategy_02_20250604_122744.csv
https://torontofrenchschooltfs.easyapply.co/,Viewjobsat TFS-Canada's International School / TFS-l'École ...,"Bilingual, co-educational, and non-denominational, TFS – Canada’s International School serves over 1,500 students from age two to university entrance. Fostering each individual’s potential along with an appreciation for one’s responsibility as a citizen, TFS nurtures young people to be whole and healthy, sound in judgment, eager to ...",torontofrenchschooltfs.easyapply.co,3,improved_bing_strategy_05_20250604_122744.csv
https://townofcharlton.easyapply.co/,Viewjobsat Town of Charlton,"Current Job Openings: Filter. Search. Apply. Equipment Operator - Charlton Highway Department. Charlton, MA. The Town of Charlton seeks to fill a full-time Equipment Operator position for our Highway Department. Under the general direction of the DPW Superintendent, the… Apply. Digital Skills Instructor - Part - Time (19 hours per week) ...",townofcharlton.easyapply.co,2,improved_bing_strategy_04_20250604_122744.csv
https://townofduxburyjobs.easyapply.co/,View jobs at Town of Duxbury,"Duxbury Massachusetts Duxbury founded in 1637, was named by Myles Standish after Duxbury Woods in his home town of Chorley, Lancashire, Great Britain. ...",townofduxburyjobs.easyapply.co,3,improved_bing_strategy_08_20250604_122744.csv
https://tweedjobs.easyapply.co/,View jobs at TUMBLEWEED INC,"May 14, 2025· Join Our Team. We are known to serve the best TEX MEX food and margaritas around. Learn how to become a part of history in joining our team. View open jobs",tweedjobs.easyapply.co,5,improved_bing_strategy_02_20250604_122744.csv
https://vacfsscareers.easyapply.co/,Vancouver Aboriginal Child & Family Services Society,"About Vancouver Aboriginal Child & Family Services Society. Situated on the unceded and occupied territories of the Coast Salish Peoples, including the xʷməθkʷəy̓əm (Musqueam), …",vacfsscareers.easyapply.co,3,improved_bing_strategy_02_20250604_122744.csv
https://valleyview.easyapply.co/,Viewjobsat Valley View Senior Life,"Junction City, KS. Speech Therapist (SLP) - PRN - Advanced notice with flexible hours (average 3-5 hours per week) Valley View Senior Life is a full-service elder care community located…",valleyview.easyapply.co,5,improved_bing_strategy_05_20250604_122744.csv
https://villagemedia.easyapply.co/,View jobs at Village Media Inc.,"About Village Media Inc. Village Media connects communities. Our hyper-local community news sites are designed to bring neighbourhoods together, connect people through a common voice …",villagemedia.easyapply.co,3,improved_bing_strategy_02_20250604_122744.csv
https://vivo.easyapply.co/,easyapply.co - View jobs at Vivo for Healthier Generations Society,Vivo is a charity with a profound purpose; to ignite a mindset to LIVE for healthier generations. Our Collaboratory applies leading practices in social innovation to co-create and measure new …,vivo.easyapply.co,1,improved_bing_strategy_04_20250604_122744.csv
https://voaselacareers.easyapply.co/,easyapply.co- Viewjobsat VOLUNTEERS OF AMERICA …,"About VOLUNTEERS OF AMERICA SOUTHEAST LOUISIANA. Since 1896, Volunteers of America's ministry of service has supported and empowered America's most vulnerable people, touching the mind, body and spirit of those we serve.",voaselacareers.easyapply.co,3,improved_bing_strategy_05_20250604_122744.csv
https://walkonsfran.easyapply.co/,easyapply.co- View jobs at Walk On's Sports Bistreaux,"About Walk On's Sports Bistreaux. In 2016, DBMC Restaurants entered into a multi-state development agreement with Walk-On’s Sports Bistreaux, a Baton Rouge-based brand offering a family-friendly, sports-themed casual dining experience.",walkonsfran.easyapply.co,4,improved_bing_strategy_08_20250604_122744.csv
https://weismanchildrens.easyapply.co/,Viewjobsat Weisman Childrens Rehabilitation Hospital,"About Weisman Childrens Rehabilitation Hospital. Weisman Children’s is a highly-acclaimed community-based specialty healthcare organization consisting of an acute rehabilitation hospital, outpatient rehabilitation and medical day care centers.",weismanchildrens.easyapply.co,3,improved_bing_strategy_05_20250604_122744.csv
https://westcoastsightseeingcareers.easyapply.co/,easyapply.co- View jobs at Big Bus Westcoast Sightseeing,Everything we do at Big Bus Westcoast Sightseeing is for a common purpose: Sharing Remarkable Experiences Together. We believe the most remarkable place on...,westcoastsightseeingcareers.easyapply.co,2,improved_bing_strategy_02_20250604_122744.csv
https://workingalternativesinc.easyapply.co/,Viewjobsat WORKING ALTERNATIVES INC,"Garden Grove, California. Department: Security (Non-Exempt) Hours per week: 40/Full Time Job Summary: Provide security shift coverage for residents in a Residential Re-Entry Center…",workingalternativesinc.easyapply.co,4,improved_bing_strategy_05_20250604_122744.csv
https://www.bing.com/rebates/welcome?url=https%3a%2f%2fwww.semrush.com%2fwebsite%2feasyapply.co%2fcompetitors%2f&murl=https%3a%2f%2fwild.link%2fe%3fc%3d81641%26d%3d2350624%26url%3dhttps%253a%252f%252fwww.semrush.com%252fwebsite%252feasyapply.co%252fcompetitors%252f%26tc%3dbing-&id=semrush&name=semrush&ra=$320&hash=b2510690e19b0b7ccf5d8fe70e3119d507eae62af44c243873302ad362416e54&network=Wildfire,Top 1 easyapply.co Alternatives & Competitors | Semrush,Up to$320cash back· Discover the full list of easyapply.co competitors and alternatives. Analyze websites like easyapply.co for free in terms of their online performance: traffic …,www.bing.com,1,improved_bing_strategy_03_20250604_122744.csv
https://www.scamadviser.com/check-website/easyapply.co,easyapply.co Reviews | check if site is scam or legit| Scamadviser,We think easyapply.co is legit and safe for consumers to access. Scamadviser is an automated algorithm to check if a website is legit and safe (or not). The review of easyapply.co has been …,www.scamadviser.com,1,improved_bing_strategy_03_20250604_122744.csv
https://www.scamadviser.com/check-website/sansomequipmentltd.easyapply.co,sansomequipmentltd.easyapply.co Reviews | scam or legit check,sansomequipmentltd.easyapply.co is very likely not a scam but legit and reliable. Our algorithm gave the review of sansomequipmentltd.easyapply.co a relatively high score.,www.scamadviser.com,1,improved_bing_strategy_03_20250604_122744.csv
https://www.semrush.com/website/easyapply.co/competitors/,Top 1easyapply.coAlternatives & Competitors | Semrush,Top 1 easyapply.co Alternatives & Competitors. Sign up for a free Semrush account to view our list of easyapply.co alternatives and competitors and analyze their performance in terms of …,www.semrush.com,5,improved_bing_strategy_03_20250604_122744.csv
https://www.statscrop.com/www/easyapply.co,Easyapply:Easyapply.co- StatsCrop,"Easyapply.co analytics: provides a concise, comprehensive, and visual report on the website Easyapply.co, including its world ranking, daily visitors, bounce rate, average time spent on …",www.statscrop.com,3,improved_bing_strategy_03_20250604_122744.csv
https://www.webwiki.com/easyapply.co,Easyapply.co - Customer Reviews - Webwiki,Worth knowing about Easyapply.co: An applicant tracking system is a software application that enables the electronic handling of recruitment needs. read more,www.webwiki.com,1,improved_bing_strategy_03_20250604_122744.csv
https://ymcaghd.easyapply.co/,easyapply.co - View jobs at YMCA of Greater …,"For 165 years we’ve cared for kids, shaped leaders for tomorrow, helped generations of people come together for support, and provide experiences that …",ymcaghd.easyapply.co,1,improved_bing_strategy_02_20250604_122744.csv
https://ywcahamilton.easyapply.co/,View jobs at YWCA Hamilton,"We at YWCA Hamilton believe that women and girls must have the rights, resources, and opportunities to shape their own lives and define their...",ywcahamilton.easyapply.co,3,improved_bing_strategy_02_20250604_122744.csv
https://zeidlerarchitecture.easyapply.co/,View jobs at Zeidler Architecture,"About Zeidler Architecture. Zeidler is a leading Canadian architectural practice with a portfolio of inspiring buildings that foster social engagement, facilitate excellence and deliver enduring value.",zeidlerarchitecture.easyapply.co,5,improved_bing_strategy_08_20250604_122744.csv
